{
  "$schema": "https://json-schema.org/draft/2020-12/schema",
  "type": "object",
  "properties": {
    "scope": {
      "type": "string",
      "enum": [
        "platform",
        "organization"
      ]
    },
    "runLimit": {
      "type": "integer",
      "exclusiveMinimum": 0,
      "maximum": 9007199254740991
    },
    "releaseLimit": {
      "type": "integer",
      "exclusiveMinimum": 0,
      "maximum": 9007199254740991
    },
    "sources": {
      "type": "array",
      "items": {
        "type": "object",
        "properties": {
          "key": {
            "type": "string",
            "minLength": 1
          },
          "connectorType": {
            "type": "string",
            "minLength": 1
          },
          "status": {
            "type": "string",
            "enum": [
              "active",
              "disabled"
            ]
          }
        },
        "required": [
          "key",
          "connectorType",
          "status"
        ],
        "additionalProperties": false
      }
    },
    "datasets": {
      "type": "array",
      "items": {
        "type": "object",
        "properties": {
          "key": {
            "type": "string",
            "minLength": 1
          },
          "sourceKey": {
            "type": "string",
            "minLength": 1
          },
          "status": {
            "type": "string",
            "enum": [
              "active",
              "disabled"
            ]
          },
          "schemaVersion": {
            "type": "integer",
            "exclusiveMinimum": 0,
            "maximum": 9007199254740991
          }
        },
        "required": [
          "key",
          "sourceKey",
          "status",
          "schemaVersion"
        ],
        "additionalProperties": false
      }
    },
    "products": {
      "type": "array",
      "items": {
        "type": "object",
        "properties": {
          "key": {
            "type": "string",
            "minLength": 1
          },
          "domainKey": {
            "type": "string",
            "minLength": 1
          },
          "status": {
            "type": "string",
            "enum": [
              "active",
              "disabled"
            ]
          },
          "datasetKeys": {
            "type": "array",
            "items": {
              "type": "string",
              "minLength": 1
            }
          }
        },
        "required": [
          "key",
          "domainKey",
          "status",
          "datasetKeys"
        ],
        "additionalProperties": false
      }
    },
    "runs": {
      "type": "array",
      "items": {
        "type": "object",
        "properties": {
          "id": {
            "type": "string",
            "minLength": 1
          },
          "kind": {
            "type": "string",
            "enum": [
              "source",
              "product"
            ]
          },
          "targetKey": {
            "type": "string",
            "minLength": 1
          },
          "mode": {
            "type": "string",
            "enum": [
              "full",
              "incremental",
              "reconcile"
            ]
          },
          "status": {
            "type": "string",
            "enum": [
              "pending",
              "running",
              "completed",
              "failed",
              "cancelled"
            ]
          },
          "errorCode": {
            "anyOf": [
              {
                "type": "string",
                "minLength": 1
              },
              {
                "type": "null"
              }
            ]
          },
          "correlationId": {
            "anyOf": [
              {
                "type": "string",
                "minLength": 1
              },
              {
                "type": "null"
              }
            ]
          },
          "createdAt": {
            "type": "string",
            "format": "date-time",
            "pattern": "^(?:(?:\\d\\d[2468][048]|\\d\\d[13579][26]|\\d\\d0[48]|[02468][048]00|[13579][26]00)-02-29|\\d{4}-(?:(?:0[13578]|1[02])-(?:0[1-9]|[12]\\d|3[01])|(?:0[469]|11)-(?:0[1-9]|[12]\\d|30)|(?:02)-(?:0[1-9]|1\\d|2[0-8])))T(?:(?:[01]\\d|2[0-3]):[0-5]\\d(?::[0-5]\\d(?:\\.\\d+)?)?(?:Z|([+-](?:[01]\\d|2[0-3]):[0-5]\\d)))$"
          },
          "startedAt": {
            "anyOf": [
              {
                "type": "string",
                "format": "date-time",
                "pattern": "^(?:(?:\\d\\d[2468][048]|\\d\\d[13579][26]|\\d\\d0[48]|[02468][048]00|[13579][26]00)-02-29|\\d{4}-(?:(?:0[13578]|1[02])-(?:0[1-9]|[12]\\d|3[01])|(?:0[469]|11)-(?:0[1-9]|[12]\\d|30)|(?:02)-(?:0[1-9]|1\\d|2[0-8])))T(?:(?:[01]\\d|2[0-3]):[0-5]\\d(?::[0-5]\\d(?:\\.\\d+)?)?(?:Z|([+-](?:[01]\\d|2[0-3]):[0-5]\\d)))$"
              },
              {
                "type": "null"
              }
            ]
          },
          "finishedAt": {
            "anyOf": [
              {
                "type": "string",
                "format": "date-time",
                "pattern": "^(?:(?:\\d\\d[2468][048]|\\d\\d[13579][26]|\\d\\d0[48]|[02468][048]00|[13579][26]00)-02-29|\\d{4}-(?:(?:0[13578]|1[02])-(?:0[1-9]|[12]\\d|3[01])|(?:0[469]|11)-(?:0[1-9]|[12]\\d|30)|(?:02)-(?:0[1-9]|1\\d|2[0-8])))T(?:(?:[01]\\d|2[0-3]):[0-5]\\d(?::[0-5]\\d(?:\\.\\d+)?)?(?:Z|([+-](?:[01]\\d|2[0-3]):[0-5]\\d)))$"
              },
              {
                "type": "null"
              }
            ]
          }
        },
        "required": [
          "id",
          "kind",
          "targetKey",
          "mode",
          "status",
          "errorCode",
          "correlationId",
          "createdAt",
          "startedAt",
          "finishedAt"
        ],
        "additionalProperties": false
      }
    },
    "releases": {
      "type": "array",
      "items": {
        "type": "object",
        "properties": {
          "id": {
            "type": "string",
            "minLength": 1
          },
          "status": {
            "type": "string",
            "enum": [
              "draft",
              "frozen",
              "revoked"
            ]
          },
          "capturedAt": {
            "type": "string",
            "format": "date-time",
            "pattern": "^(?:(?:\\d\\d[2468][048]|\\d\\d[13579][26]|\\d\\d0[48]|[02468][048]00|[13579][26]00)-02-29|\\d{4}-(?:(?:0[13578]|1[02])-(?:0[1-9]|[12]\\d|3[01])|(?:0[469]|11)-(?:0[1-9]|[12]\\d|30)|(?:02)-(?:0[1-9]|1\\d|2[0-8])))T(?:(?:[01]\\d|2[0-3]):[0-5]\\d(?::[0-5]\\d(?:\\.\\d+)?)?(?:Z|([+-](?:[01]\\d|2[0-3]):[0-5]\\d)))$"
          },
          "products": {
            "type": "array",
            "items": {
              "type": "object",
              "properties": {
                "key": {
                  "type": "string",
                  "minLength": 1
                },
                "versionId": {
                  "type": "string",
                  "minLength": 1
                },
                "status": {
                  "type": "string",
                  "enum": [
                    "building",
                    "published",
                    "failed",
                    "revoked"
                  ]
                },
                "rowCount": {
                  "type": "integer",
                  "minimum": 0,
                  "maximum": 9007199254740991
                },
                "runId": {
                  "type": "string",
                  "minLength": 1
                },
                "sources": {
                  "type": "array",
                  "items": {
                    "type": "object",
                    "properties": {
                      "datasetKey": {
                        "type": "string",
                        "minLength": 1
                      },
                      "versionId": {
                        "type": "string",
                        "minLength": 1
                      },
                      "runId": {
                        "type": "string",
                        "minLength": 1
                      },
                      "startedAt": {
                        "type": [
                          "string",
                          "null"
                        ],
                        "format": "date-time"
                      },
                      "finishedAt": {
                        "type": [
                          "string",
                          "null"
                        ],
                        "format": "date-time"
                      }
                    },
                    "required": [
                      "datasetKey",
                      "versionId",
                      "runId",
                      "startedAt",
                      "finishedAt"
                    ],
                    "additionalProperties": false
                  }
                }
              },
              "required": [
                "key",
                "versionId",
                "status",
                "rowCount",
                "runId",
                "sources"
              ],
              "additionalProperties": false
            }
          },
          "frozenAt": {
            "type": [
              "string",
              "null"
            ],
            "format": "date-time"
          }
        },
        "required": [
          "id",
          "status",
          "capturedAt",
          "products",
          "frozenAt"
        ],
        "additionalProperties": false
      }
    }
  },
  "required": [
    "scope",
    "runLimit",
    "releaseLimit",
    "sources",
    "datasets",
    "products",
    "runs",
    "releases"
  ],
  "additionalProperties": false,
  "$id": "ingestion-overview.schema.json"
}
